courseId,courseSlug,outcomeId,order,platformScreen,outcomeStatement,capacityAreaId,capacityAreaLabel,csoPracticeId,csoPracticeLabel,localOutcomeStatement,observableAction,standardFamilyId,standardFamilyLabel,indicatorId,indicatorLabel,measurementLevel,assessmentMethod,evidenceType,successCriterion,linkedModule,linkedLesson,linkedFinalTestQuestionIds,requiredBeforeReview,copyPasteNotes
COURSE-HRBA-ADVOCACY-PRACTICE,human-rights-based-advocacy-in-practice-for-local-csos,LO-HRBA-ADV-01,1,Learning Outcomes,Explain the difference between general advocacy and human rights-based advocacy.,CAP-ADV,Evidence-Based Advocacy and Civic Engagement,PRAC-ADV-SAFE-MSG,Draft safe evidence-based advocacy messages,"Participants can describe how rights holders, duty bearers, participation, accountability, non-discrimination, empowerment, and legality change the way a CSO plans advocacy.",Distinguish a general awareness-raising message from a rights-based advocacy message in a local CSO example.,STD-HRBA,Human Rights-Based Approach Principles,IND-ADV-MSG-01,EU-ADV-01 — Evidence-based advocacy message,LEARNER_KNOWLEDGE,KNOWLEDGE_CHECK,Knowledge check answer; lesson reflection,Participant correctly identifies at least two features that make advocacy rights-based rather than only general awareness raising.,Module 1 — Foundations of HRBA Advocacy,Lesson 1.1 — What Makes Advocacy Rights-Based?,FT-HRBA-ADV-01,Yes,Use outcomeStatement as the main platform outcome. Use localOutcomeStatement and observableAction in enhanced outcome fields.
COURSE-HRBA-ADVOCACY-PRACTICE,human-rights-based-advocacy-in-practice-for-local-csos,LO-HRBA-ADV-02,2,Learning Outcomes,"Identify rights holders, duty bearers, and accountability relationships in a local CSO advocacy issue.",CAP-ADV,Evidence-Based Advocacy and Civic Engagement,PRAC-ADV-SAFE-MSG,Draft safe evidence-based advocacy messages,"Participants can map who is affected by an issue, who has responsibility to respond, and how advocacy can support constructive accountability.",Complete a simple rights-holder and duty-bearer analysis for a realistic advocacy issue.,STD-HRBA,Human Rights-Based Approach Principles,IND-ADV-MSG-01,EU-ADV-01 — Evidence-based advocacy message,LEARNER_SKILL,PRACTICAL_ACTIVITY,Stakeholder mapping note; practical activity output; final test scenario,"Participant identifies at least one rights-holder group, one relevant duty-bearer, and one accountability relationship without exposing sensitive personal details.",Module 1 — Foundations of HRBA Advocacy,"Lesson 1.2 — Rights Holders, Duty Bearers, and Accountability",FT-HRBA-ADV-02,Yes,"This outcome should connect to case study, accordion, and stakeholder mapping practice blocks."
COURSE-HRBA-ADVOCACY-PRACTICE,human-rights-based-advocacy-in-practice-for-local-csos,LO-HRBA-ADV-03,3,Learning Outcomes,Translate a community concern into a clear and safe advocacy objective.,CAP-ADV,Evidence-Based Advocacy and Civic Engagement,PRAC-ADV-SAFE-MSG,Draft safe evidence-based advocacy messages,"Participants can turn a broad community concern into a focused advocacy objective that is specific, realistic, rights-based, and safe to communicate.",Rewrite a broad or risky advocacy concern into one focused advocacy objective.,STD-EU-DGNEAR,EU / DG NEAR Civil Society Guidelines,IND-ADV-MSG-01,EU-ADV-01 — Evidence-based advocacy message,PRACTICE_PERFORMANCE,BRANCHING_SCENARIO,Scenario decision; revised advocacy objective; final test answer,"Participant selects or drafts an advocacy objective that identifies the issue, affected group, desired change, and safe engagement focus.",Module 2 — From Community Concern to Safe Advocacy Objective,Lesson 2.1 — Turning Concerns into Objectives,FT-HRBA-ADV-03; FT-HRBA-ADV-04,Yes,This should be strongly linked to the enhanced branching scenario block.
COURSE-HRBA-ADVOCACY-PRACTICE,human-rights-based-advocacy-in-practice-for-local-csos,LO-HRBA-ADV-04,4,Learning Outcomes,Use basic stakeholder and risk analysis to plan responsible advocacy engagement.,CAP-ADV,Evidence-Based Advocacy and Civic Engagement,PRAC-ADV-SAFE-MSG,Draft safe evidence-based advocacy messages,"Participants can identify allies, blockers, duty-bearers, risk points, and safe communication choices before engaging in advocacy.","Choose a safe engagement strategy after reviewing stakeholder interests, civic-space sensitivity, and potential risks to affected people or the CSO.",STD-SAFE-DNH,Safeguarding and Do No Harm,IND-ADV-SAFE-02,DNH-ADV-02 — Safe civic-space communication,PRACTICE_PERFORMANCE,BRANCHING_SCENARIO,Risk checklist; safe message review; scenario consequence,"Participant chooses an option that protects confidentiality, avoids unnecessary confrontation, and keeps constructive engagement possible.",Module 2 — From Community Concern to Safe Advocacy Objective,Lesson 2.2 — Stakeholder and Risk Analysis for Safe Advocacy,FT-HRBA-ADV-05; FT-HRBA-ADV-06,Yes,"This outcome should connect to risk, safeguarding, and do-no-harm decision blocks."
COURSE-HRBA-ADVOCACY-PRACTICE,human-rights-based-advocacy-in-practice-for-local-csos,LO-HRBA-ADV-05,5,Learning Outcomes,Prepare a simple HRBA advocacy action outline for a real CSO issue.,CAP-ADV,Evidence-Based Advocacy and Civic Engagement,PRAC-ADV-SAFE-MSG,Draft safe evidence-based advocacy messages,"Participants can prepare a practical advocacy action outline that links issue, rights holders, duty bearers, evidence, risks, message, and next step.",Complete a one-page HRBA advocacy action outline using a real or realistic CSO issue while anonymizing sensitive details.,STD-HRBA,Human Rights-Based Approach Principles,IND-ADV-MSG-01; IND-ADV-SAFE-02,EU-ADV-01 — Evidence-based advocacy message; DNH-ADV-02 — Safe civic-space communication,PRACTICE_PERFORMANCE,PRACTICAL_ACTIVITY,Advocacy action outline; checklist score; final test result,"Participant completes an outline with issue, affected group, duty-bearer, objective, evidence, risks, message, and one practical next step.",Module 3 — Advocacy Action Outline and Next Steps,Lesson 3.1 — Build Your HRBA Advocacy Action Outline,FT-HRBA-ADV-07; FT-HRBA-ADV-08,Yes,This is the main practical output outcome. It does not create practical proof verification in Phase 1; it remains a practice activity.
